{"summary":{"busFactor":1,"totalFiles":192,"totalContributors":8,"criticalContributors":["Darko Pervan"]},"analysis":{"method":"Jabrayilzade et al. - JBF (Time-Weighted Bus Factor)","description":"Advanced method using knowledge decay and time-weighted contributions","finalOwnerlessRatio":0.5625,"threshold":0.5,"metadata":{"decayRate":0.5,"timeWindowDays":548,"analysisDate":"2025-07-16T06:22:21.337Z"}},"constants":{"threshold":0.5,"decayRate":0.5,"timeWindow":548},"topContributors":[{"author":"Darko Pervan","weightedDegreeOfAuthorship":"54.69%","filesOwned":105,"recentActivityScore":"23119"},{"author":"marienfeldtom","weightedDegreeOfAuthorship":"15.10%","filesOwned":29,"recentActivityScore":"11482"},{"author":"DarkoP","weightedDegreeOfAuthorship":"9.38%","filesOwned":18,"recentActivityScore":"1793"},{"author":"Axel Wolters (SK-Hamburg)","weightedDegreeOfAuthorship":"8.85%","filesOwned":17,"recentActivityScore":"873"},{"author":"Tom Marienfeld","weightedDegreeOfAuthorship":"7.29%","filesOwned":14,"recentActivityScore":"1252"},{"author":"Ramona Weitzenberg","weightedDegreeOfAuthorship":"1.56%","filesOwned":3,"recentActivityScore":"847"},{"author":"Thomas Böttcher-Holschen","weightedDegreeOfAuthorship":"1.04%","filesOwned":2,"recentActivityScore":"355"},{"author":"semantic-release-bot","weightedDegreeOfAuthorship":"0.52%","filesOwned":1,"recentActivityScore":"355"}],"fileOwnership":{".badges/.gitkeep":null,".badges/README.md":"Tom Marienfeld",".badges/kern-master-community.afdesign":"Axel Wolters (SK-Hamburg)",".badges/kern-master-community.png":"Axel Wolters (SK-Hamburg)",".badges/kern-master-community.svg":"Axel Wolters (SK-Hamburg)",".badges/kern-master-logo.afdesign":"Axel Wolters (SK-Hamburg)",".badges/kern-master-logo.png":"Axel Wolters (SK-Hamburg)",".badges/kern-master-logo.svg":"Axel Wolters (SK-Hamburg)",".badges/kern-master-partner.afdesign":"Axel Wolters (SK-Hamburg)",".badges/kern-master-partner.png":"Axel Wolters (SK-Hamburg)",".badges/kern-master-partner.svg":"Axel Wolters (SK-Hamburg)",".gitignore":"marienfeldtom",".gitlab-ci.yml":"marienfeldtom",".gitlab/.gitkeep":null,".gitlab/README.md":"Tom Marienfeld",".gitlab/issue_templates/.gitkeep":null,".gitlab/issue_templates/Bug.md":"Axel Wolters (SK-Hamburg)",".gitlab/issue_templates/Default.md":"Axel Wolters (SK-Hamburg)",".releaserc.json":"Thomas Böttcher-Holschen",".storybook/KernTheme.js":"marienfeldtom",".storybook/README.md":"Tom Marienfeld",".storybook/main.js":"marienfeldtom",".storybook/manager.js":"marienfeldtom",".storybook/preview-head.html":"Darko Pervan",".storybook/preview.js":"marienfeldtom","CHANGELOG.md":"semantic-release-bot","CODE_OF_CONDUCT.md":"Axel Wolters (SK-Hamburg)","CONTRIBUTING.md":"Axel Wolters (SK-Hamburg)","LICENSE.md":"Axel Wolters (SK-Hamburg)","PUBLISH.md":"marienfeldtom","README.md":"Axel Wolters (SK-Hamburg)","backstop.json":"Tom Marienfeld","component-layouts.md":"Darko Pervan","dist/README.md":"Tom Marienfeld","dist/fonts/fira-sans.css":"Darko Pervan","dist/fonts/fira-sans/FiraSans-Bold.woff2":"Darko Pervan","dist/fonts/fira-sans/FiraSans-BoldItalic.woff2":"Darko Pervan","dist/fonts/fira-sans/FiraSans-Book.woff2":"Darko Pervan","dist/fonts/fira-sans/FiraSans-BookItalic.woff2":"Darko Pervan","dist/fonts/fira-sans/FiraSans-Eight.woff2":"Darko Pervan","dist/fonts/fira-sans/FiraSans-EightItalic.woff2":"Darko Pervan","dist/fonts/fira-sans/FiraSans-ExtraBold.woff2":"Darko Pervan","dist/fonts/fira-sans/FiraSans-ExtraBoldItalic.woff2":"Darko Pervan","dist/fonts/fira-sans/FiraSans-ExtraLight.woff2":"Darko Pervan","dist/fonts/fira-sans/FiraSans-ExtraLightItalic.woff2":"Darko Pervan","dist/fonts/fira-sans/FiraSans-Four.woff2":"Darko Pervan","dist/fonts/fira-sans/FiraSans-FourItalic.woff2":"Darko Pervan","dist/fonts/fira-sans/FiraSans-Hair.woff2":"Darko Pervan","dist/fonts/fira-sans/FiraSans-HairItalic.woff2":"Darko Pervan","dist/fonts/fira-sans/FiraSans-Heavy.woff2":"Darko Pervan","dist/fonts/fira-sans/FiraSans-HeavyItalic.woff2":"Darko Pervan","dist/fonts/fira-sans/FiraSans-Italic.woff2":"Darko Pervan","dist/fonts/fira-sans/FiraSans-Light.woff2":"Darko Pervan","dist/fonts/fira-sans/FiraSans-LightItalic.woff2":"Darko Pervan","dist/fonts/fira-sans/FiraSans-Medium.woff2":"Darko Pervan","dist/fonts/fira-sans/FiraSans-MediumItalic.woff2":"Darko Pervan","dist/fonts/fira-sans/FiraSans-Regular.woff2":"Darko Pervan","dist/fonts/fira-sans/FiraSans-SemiBold.woff2":"Darko Pervan","dist/fonts/fira-sans/FiraSans-SemiBoldItalic.woff2":"Darko Pervan","dist/fonts/fira-sans/FiraSans-Thin.woff2":"Darko Pervan","dist/fonts/fira-sans/FiraSans-ThinItalic.woff2":"Darko Pervan","dist/fonts/fira-sans/FiraSans-Two.woff2":"Darko Pervan","dist/fonts/fira-sans/FiraSans-TwoItalic.woff2":"Darko Pervan","dist/fonts/fira-sans/FiraSans-Ultra.woff2":"Darko Pervan","dist/fonts/fira-sans/FiraSans-UltraItalic.woff2":"Darko Pervan","dist/fonts/fira-sans/FiraSans-UltraLight.woff2":"Darko Pervan","dist/fonts/fira-sans/FiraSans-UltraLightItalic.woff2":"Darko Pervan","dist/fonts/fira-sans/fira-sans.scss":"Darko Pervan","dist/fonts/noto-sans.css":"marienfeldtom","dist/fonts/noto-sans/NotoSans-Bold.woff":"marienfeldtom","dist/fonts/noto-sans/NotoSans-Bold.woff2":"marienfeldtom","dist/fonts/noto-sans/NotoSans-Regular.woff":"marienfeldtom","dist/fonts/noto-sans/NotoSans-Regular.woff2":"marienfeldtom","dist/js/kern-kopfzeile.js":"Darko Pervan","logo.png":"Axel Wolters (SK-Hamburg)","logo.svg":"Axel Wolters (SK-Hamburg)","nuget/README.md":"Tom Marienfeld","nuget/buildpackage.sh":"Thomas Böttcher-Holschen","package-lock.json":"marienfeldtom","package.json":"marienfeldtom","playwright.config.js":"marienfeldtom","scripts/README.md":"Tom Marienfeld","scripts/a11y.js":"Tom Marienfeld","scripts/update-all-release-versions.mjs":"Tom Marienfeld","src/README.md":"Tom Marienfeld","src/scss/core/components/_accordion.scss":"Darko Pervan","src/scss/core/components/_alert.scss":"Darko Pervan","src/scss/core/components/_badge.scss":"Darko Pervan","src/scss/core/components/_button.scss":"Darko Pervan","src/scss/core/components/_card.scss":"Darko Pervan","src/scss/core/components/_check.scss":"Darko Pervan","src/scss/core/components/_checkbox.scss":"Darko Pervan","src/scss/core/components/_description-list.scss":"Darko Pervan","src/scss/core/components/_dialog.scss":"Darko Pervan","src/scss/core/components/_divider.scss":"Darko Pervan","src/scss/core/components/_dropdown.scss":"Darko Pervan","src/scss/core/components/_fieldset.scss":"Darko Pervan","src/scss/core/components/_icon.scss":"Darko Pervan","src/scss/core/components/_input.scss":"Darko Pervan","src/scss/core/components/_kopfzeile.scss":"Tom Marienfeld","src/scss/core/components/_loader.scss":"Darko Pervan","src/scss/core/components/_progress.scss":"Darko Pervan","src/scss/core/components/_radio.scss":"Darko Pervan","src/scss/core/components/_select.scss":"Darko Pervan","src/scss/core/components/_summary.scss":"Darko Pervan","src/scss/core/components/_table.scss":"Darko Pervan","src/scss/core/components/_task-list.scss":"Darko Pervan","src/scss/core/global.scss":"Darko Pervan","src/scss/core/index.scss":"Darko Pervan","src/scss/core/layout/_grid.scss":"Darko Pervan","src/scss/core/tokens/_index.scss":"Darko Pervan","src/scss/core/tokens/_theme.scss":"Darko Pervan","src/scss/core/tokens/_variables.scss":"Darko Pervan","src/scss/core/tokens/primitives/_colors.scss":"Darko Pervan","src/scss/core/tokens/primitives/_font.scss":"Darko Pervan","src/scss/core/tokens/primitives/_sizes.scss":"Darko Pervan","src/scss/core/typography/_body.scss":"Darko Pervan","src/scss/core/typography/_heading.scss":"Darko Pervan","src/scss/core/typography/_label.scss":"Darko Pervan","src/scss/core/typography/_link.scss":"Darko Pervan","src/scss/core/typography/_list.scss":"Darko Pervan","src/scss/core/typography/_preline.scss":"Ramona Weitzenberg","src/scss/core/typography/_subline.scss":"Ramona Weitzenberg","src/scss/core/typography/_title.scss":"Darko Pervan","src/scss/core/utilities/_functions.scss":"marienfeldtom","src/scss/core/utilities/_icons.scss":"Darko Pervan","src/scss/core/utilities/_maps.scss":"Darko Pervan","src/scss/core/utilities/_mixins.scss":"Darko Pervan","src/scss/dataport/_theme.scss":"Darko Pervan","src/scss/dataport/index.scss":"Darko Pervan","src/scss/kern/_theme.scss":"Darko Pervan","src/scss/kern/index.scss":"marienfeldtom","static/README.md":"Tom Marienfeld","static/components.html":"Darko Pervan","static/favicon.ico":"Darko Pervan","static/logo.svg":"marienfeldtom","stories/Accordion/Accordion.stories.js":"Darko Pervan","stories/Alert/Alert.stories.js":"DarkoP","stories/Alert/AlertContent.stories.js":"Darko Pervan","stories/Badge/Badge.stories.js":"Darko Pervan","stories/Badge/BadgeIcon.stories.js":"DarkoP","stories/Body/Body.stories.js":"Darko Pervan","stories/Button/ButtonPrimary.stories.js":"Darko Pervan","stories/Button/ButtonSecondary.stories.js":"Darko Pervan","stories/Button/ButtonTertiary.stories.js":"Darko Pervan","stories/Card/Card.stories.js":"Darko Pervan","stories/Checkbox/Checkbox.stories.js":"DarkoP","stories/CheckboxList/CheckboxList.stories.js":"Darko Pervan","stories/Component Layouts.mdx":"Darko Pervan","stories/Compose.stories.js":"marienfeldtom","stories/DescriptionList/DescriptionList.stories.js":"DarkoP","stories/Dialog/Dialog.stories.js":"marienfeldtom","stories/Divider/Divider.stories.js":"DarkoP","stories/Dropdown/Dropdown.stories.js.bak":"Darko Pervan","stories/Erste Schritte.mdx":"marienfeldtom","stories/Fieldset/Fieldset.stories.js":"DarkoP","stories/Grid/Grid.stories.js":"DarkoP","stories/Heading/Heading.stories.js":"Ramona Weitzenberg","stories/Icon/Icon.stories.js":"Darko Pervan","stories/InputDate/InputDate.stories.js":"Tom Marienfeld","stories/InputEmail/InputEmail.stories.js":"DarkoP","stories/InputFile/InputFile.stories.js":"marienfeldtom","stories/InputNumber/InputNumber.stories.js":"DarkoP","stories/InputPassword/InputPassword.stories.js":"DarkoP","stories/InputTel/InputTel.stories.js":"D